,asin,name,Rating,date,verified,Title,Review,helpfulVotes,brand,item_title,url,image,overall_rating,reviewUrl,totalReviews,price,originalPrice
19118,B07CMBB6PH,CAIM,5,30-Nov-18,True,Better than a $900 phone,I feel so bad that I wasted $900 on an S9 when this is better for a 3rd of the price,1.0,HUAWEI,"HUAWEI P20 Lite (32GB + 4GB RAM) 5.84"" FHD+ Display, 4G LTE Dual SIM GSM Factory Unlocked Smartphone ANE-LX3 - International Model - No Warranty (Sakura Pink)",https://www.amazon.com/Huawei-ANE-LX3-Factory-Unlocked-International/dp/B07CMBB6PH,https://m.media-amazon.com/images/I/819xBtcnz4L._AC_UY218_ML3_.jpg,4.3,https://www.amazon.com/product-reviews/B07CMBB6PH,558,229.99,0.0
19146,B07CMBB6PH,Will- Headphone Collector,5,30-May-18,False,BEST PHONE FOR THE MONEY,Best phone in this price range. I have at&t and the service works great and lte does work for me. The phone is fast and the screen is fantastic! Pick this up!,2.0,HUAWEI,"HUAWEI P20 Lite (32GB + 4GB RAM) 5.84"" FHD+ Display, 4G LTE Dual SIM GSM Factory Unlocked Smartphone ANE-LX3 - International Model - No Warranty (Sakura Pink)",https://www.amazon.com/Huawei-ANE-LX3-Factory-Unlocked-International/dp/B07CMBB6PH,https://m.media-amazon.com/images/I/819xBtcnz4L._AC_UY218_ML3_.jpg,4.3,https://www.amazon.com/product-reviews/B07CMBB6PH,558,229.99,0.0
18968,B07CMBB6PH,Elias Wall,5,30-May-18,True,Overall fantastic smartphone. One of the best for the money,"I'll have a full review with photos incoming, but here are the basic pros and cons: Pros: Beautiful design that stands out. Notch display design allows for a high screen to body ratio and more usable screen area on a compact body. Feels sturdy in the hand. Good tactile feel of buttons. Quick and accurate fingerprint scanner. Display is vivid without looking oversaturated and bright enough to use in all but direct sunlight. Notch never intrudes on content. Good cameras. Very strong CPU performance. Good battery life. Cons: Glass back is more prone to damage, necessitates extra careful handling or use of protective cases. No water resistance. Single band WiFi. Weak GPU performance. Design: 5/5 Build Quality/Materials: 4/5 Display: 5/5 Camera: 5/5 UI/UX: 4/5 Network/Connectivity: 4/ 5 Performance: 4/5 Battery: 5/5 Value: 5/5 Personal Taste: 5/5 Total: 46/50 = 4.6/5 ~ 5/5",292.0,HUAWEI,"HUAWEI P20 Lite (32GB + 4GB RAM) 5.84"" FHD+ Display, 4G LTE Dual SIM GSM Factory Unlocked Smartphone ANE-LX3 - International Model - No Warranty (Sakura Pink)",https://www.amazon.com/Huawei-ANE-LX3-Factory-Unlocked-International/dp/B07CMBB6PH,https://m.media-amazon.com/images/I/819xBtcnz4L._AC_UY218_ML3_.jpg,4.3,https://www.amazon.com/product-reviews/B07CMBB6PH,558,229.99,0.0
18978,B07CMBB6PH,Yi Du,5,30-May-18,True,this is the best phone you can get,"For this price, this is the best phone you can get. High resolution, instant finger and face unlock, smooth application experience and lots of customized functions as well. The only downside I can think of is that it is 32 GB, not 64 GB, Great phone for sure!!!",19.0,HUAWEI,"HUAWEI P20 Lite (32GB + 4GB RAM) 5.84"" FHD+ Display, 4G LTE Dual SIM GSM Factory Unlocked Smartphone ANE-LX3 - International Model - No Warranty (Sakura Pink)",https://www.amazon.com/Huawei-ANE-LX3-Factory-Unlocked-International/dp/B07CMBB6PH,https://m.media-amazon.com/images/I/819xBtcnz4L._AC_UY218_ML3_.jpg,4.3,https://www.amazon.com/product-reviews/B07CMBB6PH,558,229.99,0.0
21359,B07J4Z9647,David Wong,5,30-Mar-19,True,Best phone I ever have.,Huawei Mate 20 Lite is the best phone I ever have... so much better than iPhone and Samsung,4.0,HUAWEI,"Huawei Mate 20 Lite SNE-LX3 64GB (Factory Unlocked) 6.3"" FHD (International Version) (Black)",https://www.amazon.com/Huawei-SNE-LX3-Factory-Unlocked-International/dp/B07J4Z9647,https://m.media-amazon.com/images/I/51eM8j7wKzL._AC_UY218_ML3_.jpg,4.4,https://www.amazon.com/product-reviews/B07J4Z9647,422,229.98,299.99
22678,B07NGDHMKL,Quarku Barfi,3,30-Mar-19,True,GOOD BUT SOUND BAD AND CAN'T MOVE APPS TO SD CARD,"This product works good:, camera, resolutions, beautiful, Fast, and outstanding BUT the sound is very bad and it doesn't allow you to move apps from the phone to the sd card. Which is very bad for such a phone. You can only move data or pictures to the sd card but that involves a bit of steps. Please I. improve it!",9.0,HUAWEI,HUAWEI P Smart 2019 Pot-LX3 32GB Unlocked GSM 4G LTE Dual Camera (13MP+2MP) Phone - Coral Red …,https://www.amazon.com/HUAWEI-Smart-Pot-LX3-Unlocked-Camera/dp/B07NGDHMKL,https://m.media-amazon.com/images/I/41xd2-SpzlL._AC_UY218_ML3_.jpg,4.2,https://www.amazon.com/product-reviews/B07NGDHMKL,21,239.99,0.0
18662,B07C6FCC8G,Matt W.,3,30-Mar-19,True,Great phone. But arrived used.,"Phone arrived used. Even though the listing says it's new. Sim ejection tool was missing. Factory installed films were missing. Minor cratches to factory screen protector. Phone works great, but the piece of mind of having a New phone is lost.",1.0,HUAWEI,"Huawei Mate 10 Pro Unlocked Phone, 6"" 6GB/128GB, AI Processor, Dual Leica Camera, Water Resistant IP67, GSM Only - Mocha Brown (US Warranty)",https://www.amazon.com/Huawei-Unlocked-Processor-Camera-Resistant/dp/B07C6FCC8G,https://m.media-amazon.com/images/I/81a51J6cq9L._AC_UY218_ML3_.jpg,4.4,https://www.amazon.com/product-reviews/B07C6FCC8G,602,389.94,0.0
18647,B07C6FCC8G,A. Huang,5,30-Mar-18,True,Excellent product! Super responsive performance,"Excellent product! Super responsive performance. The Leica lens, dual camera and camera app is just the best. Try the Huawei's patented 3D photo, it's amazing, my only issue is I can't find another app outside the phone to view this 3D photo.",2.0,HUAWEI,"Huawei Mate 10 Pro Unlocked Phone, 6"" 6GB/128GB, AI Processor, Dual Leica Camera, Water Resistant IP67, GSM Only - Mocha Brown (US Warranty)",https://www.amazon.com/Huawei-Unlocked-Processor-Camera-Resistant/dp/B07C6FCC8G,https://m.media-amazon.com/images/I/81a51J6cq9L._AC_UY218_ML3_.jpg,4.4,https://www.amazon.com/product-reviews/B07C6FCC8G,602,389.94,0.0
18592,B07C6FCC8G,Raul,5,30-Jun-18,False,This phone is under rated everywhere.,I returned my iPhone X unlocked after hearing that Apple is coming out with three new models in the last qtr of 2018. I came across this Huawei Mate 10 Pro unlocked phone and after reading some of the comments and having the opportunity to get it as an open box from Best Buy for $445.00. With the original box and accessories. It was the best decision I made.,2.0,HUAWEI,"Huawei Mate 10 Pro Unlocked Phone, 6"" 6GB/128GB, AI Processor, Dual Leica Camera, Water Resistant IP67, GSM Only - Mocha Brown (US Warranty)",https://www.amazon.com/Huawei-Unlocked-Processor-Camera-Resistant/dp/B07C6FCC8G,https://m.media-amazon.com/images/I/81a51J6cq9L._AC_UY218_ML3_.jpg,4.4,https://www.amazon.com/product-reviews/B07C6FCC8G,602,389.94,0.0
18320,B07BZXDZKN,eddy,5,30-Jun-18,True,Fast phone and great quality.,This is definitely a bargain. Fast phone and great quality.,1.0,HUAWEI,"Huawei Y6 2018 ATU-LX3 5.7"" FullView Display 16GB 2GB RAM Dual SIM 13 MP + 2 MP 4128 x 3096 Pixels Dual-LED Flash A-GPS Fingerprint Factory Unlocked No Warranty US (Gold)",https://www.amazon.com/Huawei-FullView-Dual-LED-Fingerprint-Unlocked/dp/B07BZXDZKN,https://m.media-amazon.com/images/I/61kTETZIpTL._AC_UY218_ML3_.jpg,3.7,https://www.amazon.com/product-reviews/B07BZXDZKN,27,169.99,0.0
18429,B07C6FCC8G,Adrian Cisneros,3,30-Jul-18,True,"FRONT SCREEN LOOK, IRIS AND FACE RECOGNITION & WIRELESS CHARGING. ALL MISSING.","Disappointed with the look of the front screen, It looks just like the galaxy note 5 I had a few years ago. The screen size is NOT 6"" ask they announce at amazon, it is actually smaller than the Samsung galaxy S9 Plus. Comparing the front screen on both made me cry. Another feature on Samsung for 2 generations now is FACE and IRIS recognition. Not on Huawei either. Only pattern, password, pin and their grates is fingerprint and is in the back of the phone. Oh, another huge feature missing is charging wireless. has been on Samsung since the Gaalaxy 5, Way behind. The speed is good, memory, wifi etc. Can't complain.",2.0,HUAWEI,"Huawei Mate 10 Pro Unlocked Phone, 6"" 6GB/128GB, AI Processor, Dual Leica Camera, Water Resistant IP67, GSM Only - Mocha Brown (US Warranty)",https://www.amazon.com/Huawei-Unlocked-Processor-Camera-Resistant/dp/B07C6FCC8G,https://m.media-amazon.com/images/I/81a51J6cq9L._AC_UY218_ML3_.jpg,4.4,https://www.amazon.com/product-reviews/B07C6FCC8G,602,389.94,0.0
18415,B07C6FCC8G,Zac,5,30-Jul-18,True,Best phone you have never heard of in the states!,"So I will start this by saying that I have always had a galaxy phone starting with the S5. Loved it still my favorite smartphone just wish it would not have gone to a glass sandwich went to the S7 years later when my S5. Began to show it's age now it began to do the same I now normally I would have been ok I am going to get the S9. Well at work we use Huawei switches, routers, and APs and our contact for Huawei. Let us play with his Honor 7 loved the device I began shopping around and found this for just ease $200 less than a S9 and more power. I have had this phone for a week now and I can say I love this phone the build quality is amazing it is so impressive what it can do and at the price. Definitely worth the money and recommend this phone to people looking for a new Android smartphone.",2.0,HUAWEI,"Huawei Mate 10 Pro Unlocked Phone, 6"" 6GB/128GB, AI Processor, Dual Leica Camera, Water Resistant IP67, GSM Only - Mocha Brown (US Warranty)",https://www.amazon.com/Huawei-Unlocked-Processor-Camera-Resistant/dp/B07C6FCC8G,https://m.media-amazon.com/images/I/81a51J6cq9L._AC_UY218_ML3_.jpg,4.4,https://www.amazon.com/product-reviews/B07C6FCC8G,602,389.94,0.0
19089,B07CMBB6PH,KENIA VANESSA SALAZAR SANTANA,1,30-Jul-18,True,Cellphone is missing,Cellphone is missing. Only charger and headset in the box.,5.0,HUAWEI,"HUAWEI P20 Lite (32GB + 4GB RAM) 5.84"" FHD+ Display, 4G LTE Dual SIM GSM Factory Unlocked Smartphone ANE-LX3 - International Model - No Warranty (Sakura Pink)",https://www.amazon.com/Huawei-ANE-LX3-Factory-Unlocked-International/dp/B07CMBB6PH,https://m.media-amazon.com/images/I/819xBtcnz4L._AC_UY218_ML3_.jpg,4.3,https://www.amazon.com/product-reviews/B07CMBB6PH,558,229.99,0.0
18455,B07C6FCC8G,Kindle Customer,5,30-Jan-19,True,Works in the US with Tracfone.,"I have had issues with my Samsung 6. When I had to replace it I hesitated to get another Samsung. I did not want an iphone. After reading the reviews of the Huawei Pro 20, I decided to purchase it. I called Huawei support to make sure I could transfer everything from my Samsung. The technician I spoke to encouraged me to buy the Huawei Mate 10 Pro since it had a US Warranty. I did that. Phoneclone was easy to use and in no time my phone was ready to go.I have had the phone for about a month and I am still getting used to all the camera functions but all in all, I am very pleased with the phone.",1.0,HUAWEI,"Huawei Mate 10 Pro Unlocked Phone, 6"" 6GB/128GB, AI Processor, Dual Leica Camera, Water Resistant IP67, GSM Only - Mocha Brown (US Warranty)",https://www.amazon.com/Huawei-Unlocked-Processor-Camera-Resistant/dp/B07C6FCC8G,https://m.media-amazon.com/images/I/81a51J6cq9L._AC_UY218_ML3_.jpg,4.4,https://www.amazon.com/product-reviews/B07C6FCC8G,602,389.94,0.0
21369,B07J4Z9647,Wesley Fielder,5,30-Jan-19,True,Hands down can't beat this phone for the price,Absolutely the best phone I have ever owned. Even better you can't beat the price. They push updates frequently to keep things up to data and secure. Battery life is incredible. I loved it so much I bought one for my wife to because she was missing out. My carrier is AT&T,1.0,HUAWEI,"Huawei Mate 20 Lite SNE-LX3 64GB (Factory Unlocked) 6.3"" FHD (International Version) (Black)",https://www.amazon.com/Huawei-SNE-LX3-Factory-Unlocked-International/dp/B07J4Z9647,https://m.media-amazon.com/images/I/51eM8j7wKzL._AC_UY218_ML3_.jpg,4.4,https://www.amazon.com/product-reviews/B07J4Z9647,422,229.98,299.99
24401,B07QJ7S66P,Amazon Customer,5,30-Aug-19,True,Good fun and amazing features and quality,"I absolutely love this phone. I like everything about it. Camera is exactly what is expected, phone charges quickly which I love and battery is a beast. I love the curved screen and video quality. I am a big fan of Huawei and I am happy with my phone. It arrived very quickly and I picked it up from an Amazon locker which was very easy to deal with.",8.0,HUAWEI,"Huawei Mate 20 Pro (128GB, 6GB RAM) 6.39"" Display, Leica Triple Camera, in-Screen Fingerprint, Global 4G LTE Dual SIM GSM Factory Unlocked LYA-L29 - International Model (Twilight)",https://www.amazon.com/Display-Screen-Fingerprint-Unlocked-LYA-L29/dp/B07QJ7S66P,https://m.media-amazon.com/images/I/61FXDt-ZxYL._AC_UY218_ML3_.jpg,4.3,https://www.amazon.com/product-reviews/B07QJ7S66P,12,519.99,0.0
25779,B07VYP6VLS,xiamei li,4,3-Sep-19,True,Great,There isn’t any free WiFi but calling is great and the pictures that we took looked great,7.0,HUAWEI,"Huawei Y9 Prime 2019 (128GB, 4GB RAM) 6.59"" Display, 3 AI Cameras, 4000mAh Battery, Dual SIM GSM Factory Unlocked - STK-LX3, US & Global 4G LTE International Model (Midnight Black, 128 GB)",https://www.amazon.com/Display-Cameras-4000mAh-Battery-Unlocked/dp/B07VYP6VLS,https://m.media-amazon.com/images/I/51I12mfTuAL._AC_UY218_ML3_.jpg,4.3,https://www.amazon.com/product-reviews/B07VYP6VLS,45,229.0,0.0
18633,B07C6FCC8G,智者见泉,5,3-Sep-18,True,Best phone ever,"I have been using Iphone 4s, Huawei Mate 2, Honor 5X, Huawei Mate 9, Samsung S7 edge in the past. And recently purchased Huawei Mate 10 Pro US edition. I have to admit that this phone is much better than Huawei Mate 9, the camera is way better although Mate 9 also uses Leica lenses. I would say this Mate 10 pro take pictures as good as a mirrorless nikon or sony that sells for $600 or more. The aperture is as good as the prime lens 1.8f can deliver on my Nikon SLR. The other amazing thing of Huawei Mate brand is the battery life. The Samsung S7 edge I owned has 3700 mA battery and the Huawei Mate series uses 4000 mA battery. You would assume that battery life is about the same since 3700mA is almost on par with 4000mA. That is totally wrong. Huawei Mate Series 2/9/10 delivers 2 day plus battery life with 4000mA but Samsung deliver 1 day with 3700mA. It must have to do the battery management optimization done by Huawei. The final thing I would comment is that Huawei have much better signal strength than Samsung. I work on 6th floor of a building no cellular towers nearby, my Samsung S7 consistently have about 1 bar at work and 4 bars at home. But my Huawei Mate 10 pro delivers 3 bars at work and 5 bars at home. I think this is really a great phone if you want to go contract free and knows about what you want. It is sad that Huawei decided to release Mate 20 only in Europe and Asia. This might be the only Mate phone you can buy with US warranty for a short while. The alternative, $1000 phones from Samsung or Apple? I only paid $499 for this Huawei, why should I pay more.",1.0,HUAWEI,"Huawei Mate 10 Pro Unlocked Phone, 6"" 6GB/128GB, AI Processor, Dual Leica Camera, Water Resistant IP67, GSM Only - Mocha Brown (US Warranty)",https://www.amazon.com/Huawei-Unlocked-Processor-Camera-Resistant/dp/B07C6FCC8G,https://m.media-amazon.com/images/I/81a51J6cq9L._AC_UY218_ML3_.jpg,4.4,https://www.amazon.com/product-reviews/B07C6FCC8G,602,389.94,0.0
18671,B07C6FCC8G,N. Wilson,5,3-Nov-18,True,BIG FAN OF THE HUAWEI MATE 10 PRO,"Great phone! The battery life is amazing, and the camera is outstanding. It offers 128GB of storage, and 6GB of RAM. I LOVE MY PHONE!",1.0,HUAWEI,"Huawei Mate 10 Pro Unlocked Phone, 6"" 6GB/128GB, AI Processor, Dual Leica Camera, Water Resistant IP67, GSM Only - Mocha Brown (US Warranty)",https://www.amazon.com/Huawei-Unlocked-Processor-Camera-Resistant/dp/B07C6FCC8G,https://m.media-amazon.com/images/I/81a51J6cq9L._AC_UY218_ML3_.jpg,4.4,https://www.amazon.com/product-reviews/B07C6FCC8G,602,389.94,0.0
21387,B07J4Z9647,Tobey Nause,5,3-May-19,True,amazing,speechless. I love this phone.,1.0,HUAWEI,"Huawei Mate 20 Lite SNE-LX3 64GB (Factory Unlocked) 6.3"" FHD (International Version) (Black)",https://www.amazon.com/Huawei-SNE-LX3-Factory-Unlocked-International/dp/B07J4Z9647,https://m.media-amazon.com/images/I/51eM8j7wKzL._AC_UY218_ML3_.jpg,4.4,https://www.amazon.com/product-reviews/B07J4Z9647,422,229.98,299.99
21438,B07J4Z9647,Tug D.,5,3-May-19,False,Exceptional Smartphone.,"The Mate 20 Lite is very much like the excellent Honor 8x but with a USB C charging port instead micro-USB. The phone looks and handles great and the extra-long battery life seems to defy physics. I only wish that Huawei/Honor would become more consistent with their support for North American LTE frequency bands, Wifi Calling, VoLTE and NFC. If Huawei did those things, they would have THE best smartphones in the world. And they are already very close to achieving that.",1.0,HUAWEI,"Huawei Mate 20 Lite SNE-LX3 64GB (Factory Unlocked) 6.3"" FHD (International Version) (Black)",https://www.amazon.com/Huawei-SNE-LX3-Factory-Unlocked-International/dp/B07J4Z9647,https://m.media-amazon.com/images/I/51eM8j7wKzL._AC_UY218_ML3_.jpg,4.4,https://www.amazon.com/product-reviews/B07J4Z9647,422,229.98,299.99
13492,B0711S4T9J,Joseph Bechtel,1,3-May-19,True,Don’t buy it,Didn’t work in the slightest bit. Got a SIM card and it is worthless,1.0,HUAWEI,"Huawei E8372h-608 Unlocked 150 Mbps 4G LTE WiFi USB Wingle (4G LTE in USA (AT&T only), Europe, Asia, Middle East and Africa) (White, Telenor Logo)",https://www.amazon.com/Huawei-E8372h-608-Unlocked-Wingle-Telenor/dp/B0711S4T9J,https://m.media-amazon.com/images/I/31Liqarr44L._AC_UY218_ML3_.jpg,3.2,https://www.amazon.com/product-reviews/B0711S4T9J,42,64.9,0.0
21408,B07J4Z9647,tedh,3,3-May-19,False,"PROS and CONS vs cheaper Huawei Mate SE. if you get the right model of this, it will support LTE","I recently went from a One Plus 6 to a $130 Huawei Mate SE. I don't need all the speed and specs. I never have tried a Huawei phone. Here is my experience so far. I absolutely LOVED the Mate SE. Everything worked quite well and the software was amazing! Once I realized that I wanted to stick to Huawei, I ordered the Mate 20 Lite. I wanted the bigger screen, USB-C, bigger battery, updated software, and better camera. The software on the Mate 20 Lite is a suite of useful Huawei features called Huawei ID. Access to themes, music, the cloud, and most importantly ""Find My Phone"", but NONE of this works in the USA! The Mate SE phone's Huawei software was much better but more outdated which isn't a bad thing. I don't like the direction Huawei is going. Their limited selection of ""themes"" is terrible. The Mate SE was better. Also, I have to say that the Mate SE camera wasn't as picky and worked better. I wish I could return my Mate 20 Lite, but I ordered it on another site and there is a 20% restock fee, so I'd have to fork over $40 plus shipping. The Mate 20 Lite is a decent phone, and if you get the right version of the Mate 20 Lite, you can get LTE service for AT&T. But beware, there are like 6 different variations of this phone and only one of them supports AT&T LTE. Overall I was expected more from a phone that cost double the price, and I really am not seeing a big difference between the Mate SE and the Mate 20 Light. Also, why is the Mate 20 Lite a newer phone but it STILL doesn't have Android Pie? The camera software on the Mate SE was better. If you are looking for a great budget phone, get the Mate SE and shop around as I got mine for $130. But the Mate 20 Lite just doesn't seem like an upgrade to me. The software that it does have is terrible and then there is the lack of software, like for the camera.",5.0,HUAWEI,"Huawei Mate 20 Lite SNE-LX3 64GB (Factory Unlocked) 6.3"" FHD (International Version) (Black)",https://www.amazon.com/Huawei-SNE-LX3-Factory-Unlocked-International/dp/B07J4Z9647,https://m.media-amazon.com/images/I/51eM8j7wKzL._AC_UY218_ML3_.jpg,4.4,https://www.amazon.com/product-reviews/B07J4Z9647,422,229.98,299.99
19116,B07CMBB6PH,Mariaeugenia Galvis,1,3-May-19,True,Phone is not working,Phone began malfunctioning 4 months after purchase. Don't buy this phone. Don't waste your money. I took it for repairing and guy told me that phone wasn't the original one.,1.0,HUAWEI,"HUAWEI P20 Lite (32GB + 4GB RAM) 5.84"" FHD+ Display, 4G LTE Dual SIM GSM Factory Unlocked Smartphone ANE-LX3 - International Model - No Warranty (Sakura Pink)",https://www.amazon.com/Huawei-ANE-LX3-Factory-Unlocked-International/dp/B07CMBB6PH,https://m.media-amazon.com/images/I/819xBtcnz4L._AC_UY218_ML3_.jpg,4.3,https://www.amazon.com/product-reviews/B07CMBB6PH,558,229.99,0.0
18391,B07C6FCC8G,ptang501,5,3-May-18,True,This is an awesome phone,I switched over from Samsung and have not regret it I have owned the mate 2 mate 8 mate9 and now the mate 10 Pro and have not been disappointed at all I get a lot of the same features and the phone is capable of doing basically the same as Samsung Galaxy I'm enjoying all the features and the speed that this phone has and the battery life is outstanding way better than Samsung.,14.0,HUAWEI,"Huawei Mate 10 Pro Unlocked Phone, 6"" 6GB/128GB, AI Processor, Dual Leica Camera, Water Resistant IP67, GSM Only - Mocha Brown (US Warranty)",https://www.amazon.com/Huawei-Unlocked-Processor-Camera-Resistant/dp/B07C6FCC8G,https://m.media-amazon.com/images/I/81a51J6cq9L._AC_UY218_ML3_.jpg,4.4,https://www.amazon.com/product-reviews/B07C6FCC8G,602,389.94,0.0
21534,B07JNKYBZ4,Amazon Customer,4,3-Mar-19,True,Great Phone!,"At this price point, you can't go wrong. This is a quality phone without doubt. Large screen with good color saturation and clarity. Good sound. A plethora of native settings to tweak the phone to suit your visual and performance needs. This is a not a Samsung Note 10! But for the features and performance at a little over $200, this ""beats the brakes off"" a phone that cost $600 more.",9.0,HUAWEI,"Huawei Y9 2019 JKM-LX3 6.5"" HiSilicon Kirin 710 64GB 3GB RAM Dual SIM A-GPS Fingerprint -Glonass No Warranty US (Blue)",https://www.amazon.com/JKM-LX3-HiSilicon-Fingerprint-Glonass-Warranty/dp/B07JNKYBZ4,https://m.media-amazon.com/images/I/61w9fBefa8L._AC_UY218_ML3_.jpg,4.5,https://www.amazon.com/product-reviews/B07JNKYBZ4,85,186.9,195.96
18510,B07C6FCC8G,Jaqua Young,5,3-Mar-18,True,2018 Phone of the year,"I'm coming from a Google Pixel XL, and this phone just crushes it to pieces. Almost everything about it is phenomenal. Yeah EMUI is a tad bid dated, but nothing Nova Launcher can't fix. The first week battery life was kinda meh, but after a week it REALLY turned around. On my old Pixel I would usually leave work after a 12 hour shift on about 30% with excellent signal coverage while listening to music and watching videos on break occasionally. With this thing, I do all that and more and leave with 60% battery which is just insane. Although it doesn't have a headphone jack, it kicks it pretty decent sound with a nice pair of USB C headphones. It's quick, responsive, and gorgeous to look at. I'm still learning how to work the camera, so far I've gotten decent shots but it's still not comparing to the 1st Gen Pixel camera, but it's almost there when I figure out how to handle exposure in the pro mode. All in all, I haven't loved a phone this much since the HTC M8. Truly a great device.",5.0,HUAWEI,"Huawei Mate 10 Pro Unlocked Phone, 6"" 6GB/128GB, AI Processor, Dual Leica Camera, Water Resistant IP67, GSM Only - Mocha Brown (US Warranty)",https://www.amazon.com/Huawei-Unlocked-Processor-Camera-Resistant/dp/B07C6FCC8G,https://m.media-amazon.com/images/I/81a51J6cq9L._AC_UY218_ML3_.jpg,4.4,https://www.amazon.com/product-reviews/B07C6FCC8G,602,389.94,0.0
18717,B07C6FCC8G,draak,5,3-Mar-18,False,Photo quality is amazing. The phone is fast and good looking,"Photo quality is amazing. The phone is fast and good looking. My last phone is iPhone 6s, takes me some time to get used to the android system. so far so good, cons. The Uber app seems to have compatibility issues.",1.0,HUAWEI,"Huawei Mate 10 Pro Unlocked Phone, 6"" 6GB/128GB, AI Processor, Dual Leica Camera, Water Resistant IP67, GSM Only - Mocha Brown (US Warranty)",https://www.amazon.com/Huawei-Unlocked-Processor-Camera-Resistant/dp/B07C6FCC8G,https://m.media-amazon.com/images/I/81a51J6cq9L._AC_UY218_ML3_.jpg,4.4,https://www.amazon.com/product-reviews/B07C6FCC8G,602,389.94,0.0
2488,B00D35Z6OE,R. Lasseter,1,3-Mar-14,False,Garbage,Just throw your money directly in the trash. It's far less frustrating. I have wanted to kill this phone since day 1. It has a mind of its own and it is always in full retard mode.,3.0,HUAWEI,Huawei Glory Android Prepaid Phone (Net10),https://www.amazon.com/Huawei-Glory-Android-Prepaid-Phone/dp/B00D35Z6OE,https://m.media-amazon.com/images/I/81iP8QUNElL._AC_UY218_ML3_.jpg,3.1,https://www.amazon.com/product-reviews/B00D35Z6OE,36,27.9,0.0
23926,B07Q2X19LG,ALBERTO M.,5,3-Jun-19,True,GOOD PHONE,"QUALITY, GOOD CAMERA, PRICE",2.0,HUAWEI,"Huawei P30 128GB+6GB RAM (ELE-L29) 6.1"" LTE Factory Unlocked GSM Smartphone (International Version) (Black)",https://www.amazon.com/ELE-L29-Factory-Unlocked-Smartphone-International/dp/B07Q2X19LG,https://m.media-amazon.com/images/I/61jJeZBliWL._AC_UY218_ML3_.jpg,4.5,https://www.amazon.com/product-reviews/B07Q2X19LG,115,513.99,749.99
