,asin,name,Rating,date,verified,Title,Review,helpfulVotes,brand,item_title,url,image,overall_rating,reviewUrl,totalReviews,price,originalPrice
21336,B07J4Z9647,LaChino1980,5,18-Feb-19,True,2nd Huawei phone I bought. Excellent Phone! Totally reliable and excellent battery life!,"This is my second Huawei phone I bought. So for all you first timer and a bit skeptical, I can understand your thoughts initially. But let me assure you this phone is excellent!!! I have used Samsung phones, iPhone and Huawei phones. I can tell you it works the same and at times surpasses the others. It doesnt get hot during recharging like the other two. Life of battery is EXCELLENT. Camera resolution, on par as those of the other two cell phone brand. I really cannot find any drawback in this phone. You may need a little time to get adjusted to the operating software, but it is still Android based and it should take no time to get adjusted. And to be quite honest, in terms of internet usage, Huawei surpasses the other two brand. Its more reliable and faster. The best part is, the price is unbeatable!!! In today's age where cell phones are becoming standard commodity, there is no need to spend USD 1K for a cell phone. This Huawei will do the job just fine. Plus more for a few hundred bucks!!! CANT BEAT THIS DEAL!!!",6.0,HUAWEI,"Huawei Mate 20 Lite SNE-LX3 64GB (Factory Unlocked) 6.3"" FHD (International Version) (Black)",https://www.amazon.com/Huawei-SNE-LX3-Factory-Unlocked-International/dp/B07J4Z9647,https://m.media-amazon.com/images/I/51eM8j7wKzL._AC_UY218_ML3_.jpg,4.4,https://www.amazon.com/product-reviews/B07J4Z9647,422,229.98,299.99
21425,B07J4Z9647,Ting,4,18-Feb-19,True,"Great battery life, not so great low light images/video quality","Really great battery life, and great screen quality. The only thing that I can notice a quality decline from my previous Samsung S8 is the camera quality in low light -- in photos and video. I also initially had an issue with sending group texts or texts with photos, and I almost came close to returning the phone, but I realized that you had to set up the APN. No longer any issues and very happy with the purchase.",1.0,HUAWEI,"Huawei Mate 20 Lite SNE-LX3 64GB (Factory Unlocked) 6.3"" FHD (International Version) (Black)",https://www.amazon.com/Huawei-SNE-LX3-Factory-Unlocked-International/dp/B07J4Z9647,https://m.media-amazon.com/images/I/51eM8j7wKzL._AC_UY218_ML3_.jpg,4.4,https://www.amazon.com/product-reviews/B07J4Z9647,422,229.98,299.99
21647,B07K1M36CM,Santi,5,18-Feb-19,True,5 estrellas,"Perfecto, tiene todo lo que esperaba",3.0,HUAWEI,"Huawei Mate 20 Pro LYA-L29 128GB + 6GB - Factory Unlocked International Version - GSM ONLY, NO CDMA - No Warranty in The USA (Black)",https://www.amazon.com/Huawei-Mate-LYA-L29-128GB-International/dp/B07K1M36CM,https://m.media-amazon.com/images/I/61QcWsvnpQL._AC_UY218_ML3_.jpg,4.6,https://www.amazon.com/product-reviews/B07K1M36CM,153,459.99,0.0
18570,B07C6FCC8G,Sam,5,18-Feb-18,True,I'm amazed. I upgraded from the Mate 7,"I just received this phone today, and jesus christ, I'm amazed. I upgraded from the Mate 7. I haven't encountered any issues yet in my 12 hours of usage...but we'll see what happens.",6.0,HUAWEI,"Huawei Mate 10 Pro Unlocked Phone, 6"" 6GB/128GB, AI Processor, Dual Leica Camera, Water Resistant IP67, GSM Only - Mocha Brown (US Warranty)",https://www.amazon.com/Huawei-Unlocked-Processor-Camera-Resistant/dp/B07C6FCC8G,https://m.media-amazon.com/images/I/81a51J6cq9L._AC_UY218_ML3_.jpg,4.4,https://www.amazon.com/product-reviews/B07C6FCC8G,602,389.94,0.0
17972,B079PS2HZM,cfranklin,5,18-Feb-18,False,EXCELLENT PHONE,"I got this phone, and let me you it's really good. This phone was a step up from a ZTE Blade Spark I had. Now I'm getting better signal, quicker internet, better call quality, lighter handling weight, just a all around good phone.",5.0,HUAWEI,"Huawei Ascend XT 2 | (16GB, 2GB RAM) | 5.5"" IPS Display | Dual Camera | 4000 mAh Battery | Android 7.0 Nougat | 4G LTE | GSM Unlocked | Smartphone - Silver",https://www.amazon.com/Huawei-Unlocked-H1711-Android-Desbloqueado/dp/B079PS2HZM,https://m.media-amazon.com/images/I/41g713JM1cL._AC_UY218_ML3_.jpg,3.9,https://www.amazon.com/product-reviews/B079PS2HZM,79,99.99,0.0
18577,B07C6FCC8G,Ancher,5,18-Feb-18,True,Not compatible with AT&T 4G LTE - FIXED!,"this is my preliminary review. I just got this phone (US version w/ $150 gc) 4 hours ago. I've spent the past 3.5 hours with at&t agents trying to get the mobile data to work. The technicians tried numerous ways. The phone got reboot multiple times. After hours of battling it still wouldn't work. When I almost wanted to give up, the data network suddenly started to be working, but only on the 3g network. (One more thing, through out the whole process, there was a switch of ""Enable 4G"" in the mobile network setting. It simply cannot be turned on.) The AT&T agent explained that there is no guarantee the non-AT&T-branded phone would necessarily be able to run on the fastest LTE network, even though the device hardware is compatible. I just don't buy that theory, unless HUAWEI is intentionally selling this phone in the US market with the anticipation that it could only work on the 3g network. I don't believe HUAWEI would do such self-harming thing. Overall the phone is fast and amazing. The one star is mostly for its network connection, which I hope AT&T/HUAWEI could help me resolve eventually. ============================ day1, update: I reached out to HUAWEI support after I was done with AT&T customer service. The HUAWEI representative was patient and suggested me to get a new SIM card to test. I will update my review once I have more information down the road. ============================ day 2, update: went to the AT&T store after work. The staff (Johnson who by the way was nice and patient with me the whole time) inserted his SIM card into my mate 10 pro. Then the 4G LTE worked immediately. It made me to believe that all I need to do was to get a new SIM. However after he put in the new SIM card, the phone still runs on 3G. We then pulled it out and put it in his phone, which got no data at all. (there was some awkward silence). Then he noticed my data plan was the old Share w/ rollover plan. He explained to me it was my plan (thus the SIM) that's causing all this issue. Some phones (like his Moto or mine) will not work with the old plan. Yet iphone, BB or Samsung phones are able to because these phones got something special to boost up their signal. He then tried to convince me that changing my data plan to the latest one would ultimately resolve this issue. I refused and went home with a new SIM card in my phone yet the same issue as 1.5 hours ago. As frustrated and helpless, I decided to do one last testing then I would call it a day. I swapped my SIM card with my wife's iPhone7's (we share the same family plan). I first put her SIM in mine, my phone got 4G LTE!! then my SIM card in hers, her iPhone got 4G LTE too!! I couldn't believed my eyes. I swapped them back, carefully, worrying that I might lose this too-good-to-be-true. Surprisingly my mate 10 pro is running on 4G LTE now. I cannot explain it. Maybe it's the influence of the new SIM kicked in with some time lag. But anyhow it worked. I have since then checked a dozen more times the LTE is still on. Now I changed my rating to 5 stars which this phone deserves.",22.0,HUAWEI,"Huawei Mate 10 Pro Unlocked Phone, 6"" 6GB/128GB, AI Processor, Dual Leica Camera, Water Resistant IP67, GSM Only - Mocha Brown (US Warranty)",https://www.amazon.com/Huawei-Unlocked-Processor-Camera-Resistant/dp/B07C6FCC8G,https://m.media-amazon.com/images/I/81a51J6cq9L._AC_UY218_ML3_.jpg,4.4,https://www.amazon.com/product-reviews/B07C6FCC8G,602,389.94,0.0
18467,B07C6FCC8G,S&amp;K,5,18-Feb-18,True,The Mate 10 pro is so good. I was an IPhone User and use IPhone ...,"The Mate 10 pro is so good. I was an IPhone User and use IPhone 5-7P. IPhone was my favorite phone but IOS 11 makes me craze. There are some many bugs so I finally want to transfer to Android. I did a lot of research and finally choose Huawei mate 10 pro. I just receive it today and used for several hours. It is so good, especially the camera. It can recognize the object. The AI chip is the best. Very glad to have this phone. I will recommend to my friends.",14.0,HUAWEI,"Huawei Mate 10 Pro Unlocked Phone, 6"" 6GB/128GB, AI Processor, Dual Leica Camera, Water Resistant IP67, GSM Only - Mocha Brown (US Warranty)",https://www.amazon.com/Huawei-Unlocked-Processor-Camera-Resistant/dp/B07C6FCC8G,https://m.media-amazon.com/images/I/81a51J6cq9L._AC_UY218_ML3_.jpg,4.4,https://www.amazon.com/product-reviews/B07C6FCC8G,602,389.94,0.0
18379,B07C6FCC8G,UmmHi,5,18-Feb-18,True,"Amazing phone, no regrets!","I just received the Mate 10 Pro today, and I am blown away by its performance. I've put it through hell and the battery has exceeded my expectations. This phone easily has the best battery performance I have ever seen in a cell phone. The camera is great, the screen is bright and has great resolution. The fingerprint sensor is fast, and precise. I love how quickly it responds to touch. The processor is fast, and everything has been running smoothly. I'm using the phone on T-mobile - - no problems at all. Don't believe the negative propaganda. I have used Samsung and Apple phones in the past, and can honestly say that the Mate 10 Pro is a high quality phone equal to (and maybe even surpassing) some of the better known brands. This phone is worth a try!",198.0,HUAWEI,"Huawei Mate 10 Pro Unlocked Phone, 6"" 6GB/128GB, AI Processor, Dual Leica Camera, Water Resistant IP67, GSM Only - Mocha Brown (US Warranty)",https://www.amazon.com/Huawei-Unlocked-Processor-Camera-Resistant/dp/B07C6FCC8G,https://m.media-amazon.com/images/I/81a51J6cq9L._AC_UY218_ML3_.jpg,4.4,https://www.amazon.com/product-reviews/B07C6FCC8G,602,389.94,0.0
21366,B07J4Z9647,Amazon AlMo,4,18-Dec-18,True,Check the model for NFC support,"Good phone overall. Quick response for daily use apps like Snapshot Facebook, YouTube ext. ... Decent camera. My only complain/dislike will be that depending on the Mate model it will not have NFC. Make sure you check the model, in my case the SNE-LX3 doesn't have NFC. Other than that so far im happy with my purchase. Oh and I do get AT&T LTE.",2.0,HUAWEI,"Huawei Mate 20 Lite SNE-LX3 64GB (Factory Unlocked) 6.3"" FHD (International Version) (Black)",https://www.amazon.com/Huawei-SNE-LX3-Factory-Unlocked-International/dp/B07J4Z9647,https://m.media-amazon.com/images/I/51eM8j7wKzL._AC_UY218_ML3_.jpg,4.4,https://www.amazon.com/product-reviews/B07J4Z9647,422,229.98,299.99
18733,B07C8H8G4L,Sunshine,4,18-Dec-18,True,PRODUCT DESCRUPTION,"I have not been able to test or use the hotspot but it arrived in a timely manner, it looks to be ok comes on. My only complaint is the product description in the item page on Amazon. It give the indication you can use an external antenna on the hotspot but when you examine it there are no external connectors anywhere. I bought an external antenna in hopes of using with this hotspot but can't. As stated above try to make sure the description of the item your selling is accurate. I will not return because of time constraints.",1.0,HUAWEI,Router Hotspot 4G LTE Unlocked GSM (LTE USA AT&T T-mobile Metro Pcs Cricket Latin & Caribbean) Huawei E5573s-508 up to 10 wifi users CAT4,https://www.amazon.com/Hotspot-Unlocked-T-mobile-Caribbean-E5573s-508/dp/B07C8H8G4L,https://m.media-amazon.com/images/I/31F-nzxA29L._AC_UY218_ML3_.jpg,3.5,https://www.amazon.com/product-reviews/B07C8H8G4L,48,78.9,0.0
18389,B07C6FCC8G,Brandon,5,18-Dec-18,True,Apple/Samsung Killer,"I never thought I would stray from the Samsung Galaxy line of phones, but Huawei made me do it. This is my first device by them after randomly coming across this phone on Amazon. Everything you've read about this phone is accurate. The fingerprint reader is lighting fast and accurate. The camera is superb. The battery is out of this world. They took everything great from Apple and Samsung and made a better product in the end. A lot of reviews talk about how heavily skinned the os is, mainly because of how it comes with the option to not have an app drawer.... but my Galaxy s7 had the same feature. I even like the health app better from Huawei. Seeing my steps right on the lockscreen is just another neat feature. I bought a case from mine because I drop my phone more than the average user, but for everyone else it comes with a light rubber case, and a screen protector preinstalled. You won't regret this purchase. Buy it",10.0,HUAWEI,"Huawei Mate 10 Pro Unlocked Phone, 6"" 6GB/128GB, AI Processor, Dual Leica Camera, Water Resistant IP67, GSM Only - Mocha Brown (US Warranty)",https://www.amazon.com/Huawei-Unlocked-Processor-Camera-Resistant/dp/B07C6FCC8G,https://m.media-amazon.com/images/I/81a51J6cq9L._AC_UY218_ML3_.jpg,4.4,https://www.amazon.com/product-reviews/B07C6FCC8G,602,389.94,0.0
24403,B07QJ7S66P,Christian Rojas,2,18-Aug-19,False,Pantalla demasiado delicada,"La pantalla se rompió porque se topo con un lapicero en el bolso, y no logro conseguir el repuesto",3.0,HUAWEI,"Huawei Mate 20 Pro (128GB, 6GB RAM) 6.39"" Display, Leica Triple Camera, in-Screen Fingerprint, Global 4G LTE Dual SIM GSM Factory Unlocked LYA-L29 - International Model (Twilight)",https://www.amazon.com/Display-Screen-Fingerprint-Unlocked-LYA-L29/dp/B07QJ7S66P,https://m.media-amazon.com/images/I/61FXDt-ZxYL._AC_UY218_ML3_.jpg,4.3,https://www.amazon.com/product-reviews/B07QJ7S66P,12,519.99,0.0
18557,B07C6FCC8G,ismael marquez,5,18-Aug-18,True,Camera super,Nice phone,1.0,HUAWEI,"Huawei Mate 10 Pro Unlocked Phone, 6"" 6GB/128GB, AI Processor, Dual Leica Camera, Water Resistant IP67, GSM Only - Mocha Brown (US Warranty)",https://www.amazon.com/Huawei-Unlocked-Processor-Camera-Resistant/dp/B07C6FCC8G,https://m.media-amazon.com/images/I/81a51J6cq9L._AC_UY218_ML3_.jpg,4.4,https://www.amazon.com/product-reviews/B07C6FCC8G,602,389.94,0.0
18390,B07C6FCC8G,shopper,5,18-Aug-18,True,Perfectly works in the USA including wifi calling,"I was skeptical about this product working in the US. It has been two weeks. I have T-Mobile as my carrier. Calls are clear and wifi calling works as well. Pictures are vivid and colorful and the phone comes with a lot of features. Model is as comparable to other flagships. Sound for media is good but not best, yet not lower than other popular models. I have always used Samsung flagships and my wife uses Moto Force 2. Overall, for the price and the features of this phone, it is a Good Buy.",13.0,HUAWEI,"Huawei Mate 10 Pro Unlocked Phone, 6"" 6GB/128GB, AI Processor, Dual Leica Camera, Water Resistant IP67, GSM Only - Mocha Brown (US Warranty)",https://www.amazon.com/Huawei-Unlocked-Processor-Camera-Resistant/dp/B07C6FCC8G,https://m.media-amazon.com/images/I/81a51J6cq9L._AC_UY218_ML3_.jpg,4.4,https://www.amazon.com/product-reviews/B07C6FCC8G,602,389.94,0.0
18515,B07C6FCC8G,Mark,5,18-Aug-18,True,Better than Mehh.,Good phone is easy to set up. So far I've had a good experience with it.,1.0,HUAWEI,"Huawei Mate 10 Pro Unlocked Phone, 6"" 6GB/128GB, AI Processor, Dual Leica Camera, Water Resistant IP67, GSM Only - Mocha Brown (US Warranty)",https://www.amazon.com/Huawei-Unlocked-Processor-Camera-Resistant/dp/B07C6FCC8G,https://m.media-amazon.com/images/I/81a51J6cq9L._AC_UY218_ML3_.jpg,4.4,https://www.amazon.com/product-reviews/B07C6FCC8G,602,389.94,0.0
18650,B07C6FCC8G,TechDog,5,18-Aug-18,True,Fantastic phone,"This is a great phone, runs smooth and fast, awesome camera, fantastic battery life (2-3 days on a charge), and feels good in your hand. I have friends and family using the latest iPhone and Galaxy devices, and I'd take the Mate 10 Pro over them no question, if I had to buy another.",1.0,HUAWEI,"Huawei Mate 10 Pro Unlocked Phone, 6"" 6GB/128GB, AI Processor, Dual Leica Camera, Water Resistant IP67, GSM Only - Mocha Brown (US Warranty)",https://www.amazon.com/Huawei-Unlocked-Processor-Camera-Resistant/dp/B07C6FCC8G,https://m.media-amazon.com/images/I/81a51J6cq9L._AC_UY218_ML3_.jpg,4.4,https://www.amazon.com/product-reviews/B07C6FCC8G,602,389.94,0.0
18656,B07C6FCC8G,Francesco L,5,18-Aug-18,True,The best phone I've ever had,The best phone I've ever had. Fast light excellent screen. The photos are spectacular. the battery charge super fast and lasts all day without problems. Never a lag. I highly recommend it to everyone. The signal reception is optimal.,1.0,HUAWEI,"Huawei Mate 10 Pro Unlocked Phone, 6"" 6GB/128GB, AI Processor, Dual Leica Camera, Water Resistant IP67, GSM Only - Mocha Brown (US Warranty)",https://www.amazon.com/Huawei-Unlocked-Processor-Camera-Resistant/dp/B07C6FCC8G,https://m.media-amazon.com/images/I/81a51J6cq9L._AC_UY218_ML3_.jpg,4.4,https://www.amazon.com/product-reviews/B07C6FCC8G,602,389.94,0.0
18322,B07BZXDZKN,R. Simmons,1,18-Aug-18,False,Worst phone I have ever owned.,"I must say, this phone looks and feels great. Unfortunately that led me to buy it. SO S L O W,or just freezes completely, phone calls not coming through. After several hours of no calls, check voicemail, 11 messages. Text messaging does works but someone sitting right beside me did a call test and out of about 20-25 calls, 2 were actually received. When powering the screen on or off, approximately 10-15 second delay after pushing the button.I have to restart about 7-10x/say. Came across the listing for it, as I am currently looking for a replacement phone, and decided I just had to leave a review. This phone has definitely turned me away from all Huawei phones and that's a real shame ,but NEVER has a phone been so frustrating! It has taken everything I have not to sling it out in the front yard or smash it with a hammer. Perhaps that's why I'm so excited to get a new phone, so I can do just that. Save your $, your sanity, don't buy this piece of crap phone.",4.0,HUAWEI,"Huawei Y6 2018 ATU-LX3 5.7"" FullView Display 16GB 2GB RAM Dual SIM 13 MP + 2 MP 4128 x 3096 Pixels Dual-LED Flash A-GPS Fingerprint Factory Unlocked No Warranty US (Gold)",https://www.amazon.com/Huawei-FullView-Dual-LED-Fingerprint-Unlocked/dp/B07BZXDZKN,https://m.media-amazon.com/images/I/61kTETZIpTL._AC_UY218_ML3_.jpg,3.7,https://www.amazon.com/product-reviews/B07BZXDZKN,27,169.99,0.0
13496,B0711S4T9J,Joseph K.,5,18-Aug-17,True,Five Stars,Great product that works in Kuwait!!!,4.0,HUAWEI,"Huawei E8372h-608 Unlocked 150 Mbps 4G LTE WiFi USB Wingle (4G LTE in USA (AT&T only), Europe, Asia, Middle East and Africa) (White, Telenor Logo)",https://www.amazon.com/Huawei-E8372h-608-Unlocked-Wingle-Telenor/dp/B0711S4T9J,https://m.media-amazon.com/images/I/31Liqarr44L._AC_UY218_ML3_.jpg,3.2,https://www.amazon.com/product-reviews/B0711S4T9J,42,64.9,0.0
23895,B07Q2WPMNB,jkaman,5,17-Sep-19,True,Awesome processors and camera,Great phone we'll worth the money!!!👍💸💯,1.0,HUAWEI,HUAWEI P30 Pro Factory Unlocked International Version 128GB Black,https://www.amazon.com/HUAWEI-Factory-Unlocked-International-Version/dp/B07Q2WPMNB,https://m.media-amazon.com/images/I/51zDfRUUhHL._AC_UY218_ML3_.jpg,4.2,https://www.amazon.com/product-reviews/B07Q2WPMNB,38,686.99,0.0
18399,B07C6FCC8G,JAP73,5,17-Oct-18,True,So far so great,"I already owned a Huawei tablet so I knew how good their quality was. When my less than a year old G8 phone overheated over night and the screen looked like it took LSD, I decided to get this phone. The only negative is it has no wireless charging which is ridiculous for a pro phone. However it has double the internal storage of the G8 and 2 more gb of memory. I was surprised that it came with a basic gel case and a screen protector already on it. Nice but I will still get a different case. Aa little surprised it has no microSD slot but again it has 128gb of storage so not really needed especially in the world of cloud storage. *Update* While this phone is still the best I have ever had, I have come to discover it is not compatible with my Fitbit Vera as far as syncing the clock/apps/faces via wifi. This is not to say that it won't discover and pair via bluetooth. But to setup a fitbit from start you need wifi. Thankfully it was already setup via a previous phone so it is still usable as long as I do not want to change any settings. (which I would have to do with the previous phone now)",6.0,HUAWEI,"Huawei Mate 10 Pro Unlocked Phone, 6"" 6GB/128GB, AI Processor, Dual Leica Camera, Water Resistant IP67, GSM Only - Mocha Brown (US Warranty)",https://www.amazon.com/Huawei-Unlocked-Processor-Camera-Resistant/dp/B07C6FCC8G,https://m.media-amazon.com/images/I/81a51J6cq9L._AC_UY218_ML3_.jpg,4.4,https://www.amazon.com/product-reviews/B07C6FCC8G,602,389.94,0.0
18402,B07C6FCC8G,Cindy He,1,17-Oct-18,True,"Defective Software, missing charger, dirty package","The software is defective as I couldn't sign in with my google account because it keeps telling me to use one of the owners' account to sign in, however, this is a brand new phone. I tried skipped through this and data transfer and finger print unlock then it takes me back to page 1, which is the language selection. This was an endless cycle and the technical support said I might have received a defective phone. Also, the charger (usb-c) is completely missing from the package, the USB adapter is sealed but dirt and it says LG electronics on it? I wonder if this was a returned item from someone else though the phone looks completely brand new, untouched, and free of any finger prints. After reading more reviews and the software update issues mentioned by multiple people, I am not going to place another order. Who knows if Huawei would give up the US market amid the tension with US. Other than the issues mentioned above, I think it's got a very slick design and the screen is very clear and sharp.",7.0,HUAWEI,"Huawei Mate 10 Pro Unlocked Phone, 6"" 6GB/128GB, AI Processor, Dual Leica Camera, Water Resistant IP67, GSM Only - Mocha Brown (US Warranty)",https://www.amazon.com/Huawei-Unlocked-Processor-Camera-Resistant/dp/B07C6FCC8G,https://m.media-amazon.com/images/I/81a51J6cq9L._AC_UY218_ML3_.jpg,4.4,https://www.amazon.com/product-reviews/B07C6FCC8G,602,389.94,0.0
17878,B079HG7TZS,Shiau,4,17-Oct-18,True,Good value for your money. But battery life could be an issue.,"I've only had the phone for a few days, but somehow my battery drains really fast. I don't have many apps downloaded because I have not made the full transition from my old phone to this one. During the night, it will drain about 10% after full charge. The charging is also super slow when I charge it during the day. On the plus side, the camera quality is quite nice! I like that the most.",3.0,HUAWEI,"Huawei P Smart (32GB) 5.6"" Fullview Display & Dual Camera's, 4G LTE Dual-SIM Factory Unlocked w/ Fingerprint Scanner FIG-L23 International Model, No Warranty (Black)",https://www.amazon.com/Fullview-Dual-SIM-Fingerprint-FIG-L23-International/dp/B079HG7TZS,https://m.media-amazon.com/images/I/51+UNS7GlGL._AC_UY218_ML3_.jpg,4.4,https://www.amazon.com/product-reviews/B079HG7TZS,34,179.99,0.0
19049,B07CMBB6PH,Amazon Customer,4,17-Oct-18,True,Good choice.,Good budget phone. It looks awesome! Feels great!,1.0,HUAWEI,"HUAWEI P20 Lite (32GB + 4GB RAM) 5.84"" FHD+ Display, 4G LTE Dual SIM GSM Factory Unlocked Smartphone ANE-LX3 - International Model - No Warranty (Sakura Pink)",https://www.amazon.com/Huawei-ANE-LX3-Factory-Unlocked-International/dp/B07CMBB6PH,https://m.media-amazon.com/images/I/819xBtcnz4L._AC_UY218_ML3_.jpg,4.3,https://www.amazon.com/product-reviews/B07CMBB6PH,558,229.99,0.0
18636,B07C6FCC8G,Passing_through,5,17-Nov-18,True,This phone is my first non-apple device; serving me very well. Great price for the features!,"I used this phone to switch from apple to android. Not an issue, deregistered from facetime a day before I switched phones. Phone has been in use for 5 months. Camera is fantastic, reception for wifi and cell has been solid, the case that came with it has kept it from flying out of my hand, and usb-c is robust! I 3d printed a stand for the phone where the usb-c plugs in when I stow it at night, works perfectly. There are features I don’t use. I still use wired headset and the adapter that came with it workes perfectly.",1.0,HUAWEI,"Huawei Mate 10 Pro Unlocked Phone, 6"" 6GB/128GB, AI Processor, Dual Leica Camera, Water Resistant IP67, GSM Only - Mocha Brown (US Warranty)",https://www.amazon.com/Huawei-Unlocked-Processor-Camera-Resistant/dp/B07C6FCC8G,https://m.media-amazon.com/images/I/81a51J6cq9L._AC_UY218_ML3_.jpg,4.4,https://www.amazon.com/product-reviews/B07C6FCC8G,602,389.94,0.0
21434,B07J4Z9647,Edmar,5,17-May-19,True,Great phone,It's a great phone for the price.,1.0,HUAWEI,"Huawei Mate 20 Lite SNE-LX3 64GB (Factory Unlocked) 6.3"" FHD (International Version) (Black)",https://www.amazon.com/Huawei-SNE-LX3-Factory-Unlocked-International/dp/B07J4Z9647,https://m.media-amazon.com/images/I/51eM8j7wKzL._AC_UY218_ML3_.jpg,4.4,https://www.amazon.com/product-reviews/B07J4Z9647,422,229.98,299.99
18981,B07CMBB6PH,Austin McKnight,5,17-May-18,True,Keep up the great work HUAWEI,"Got yesterday, already loving it! Keep up the great work HUAWEI!",14.0,HUAWEI,"HUAWEI P20 Lite (32GB + 4GB RAM) 5.84"" FHD+ Display, 4G LTE Dual SIM GSM Factory Unlocked Smartphone ANE-LX3 - International Model - No Warranty (Sakura Pink)",https://www.amazon.com/Huawei-ANE-LX3-Factory-Unlocked-International/dp/B07CMBB6PH,https://m.media-amazon.com/images/I/819xBtcnz4L._AC_UY218_ML3_.jpg,4.3,https://www.amazon.com/product-reviews/B07CMBB6PH,558,229.99,0.0
